23726,https://en.wikipedia.org/wiki/%27Afar_Af_language,"Didier Morin.","See alsoNotesBibliography","is"
23727,https://en.wikipedia.org/wiki/%27Afar_Af_language,"1997.","See alsoNotesBibliography","is"
23728,https://en.wikipedia.org/wiki/%27Afar_Af_language,"Poésie traditionnelle des Afars.","See alsoNotesBibliography","is"
23729,https://en.wikipedia.org/wiki/%27Afar_Af_language,"Langues et cultures africaines, 21 / SELAF vol.","See alsoNotesBibliography","is"
23730,https://en.wikipedia.org/wiki/%27Afar_Af_language,"363.","See alsoNotesBibliography","is"
23731,https://en.wikipedia.org/wiki/%27Afar_Af_language,"Paris/Louvain: Peeters.","See alsoNotesBibliography","is"
23732,https://en.wikipedia.org/wiki/%27Afar_Af_language,"Enid M. Parker.","See alsoNotesBibliography","is"
23733,https://en.wikipedia.org/wiki/%27Afar_Af_language,"2006.","See alsoNotesBibliography","is"
23734,https://en.wikipedia.org/wiki/%27Afar_Af_language,"English–Afar Dictionary.","See alsoNotesBibliography","is"
23735,https://en.wikipedia.org/wiki/%27Afar_Af_language,"Washington DC:  Dunwoody Press.","See alsoNotesBibliography","is"
23736,https://en.wikipedia.org/wiki/%27Afifa_Karam,"Badī'a wa Fu'ād (1906)","Karam's novels and translations include:","include"
23737,https://en.wikipedia.org/wiki/%27Afifa_Karam,"Fāṭima al-Badawīyya (ca.","Karam's novels and translations include:","include"
23738,https://en.wikipedia.org/wiki/%27Afifa_Karam,"1908)","Karam's novels and translations include:","include"
23739,https://en.wikipedia.org/wiki/%27Afifa_Karam,"Ghādat 'Amshīt (ca.","Karam's novels and translations include:","include"
23740,https://en.wikipedia.org/wiki/%27Afifa_Karam,"1910)","Karam's novels and translations include:","include"
23741,https://en.wikipedia.org/wiki/%27Afifa_Karam,"Nānsī Stāyir (1914) [Arabic translation of Nancy Stair by Elinor Macartney Lane]","Karam's novels and translations include:","include"
23742,https://en.wikipedia.org/wiki/%27Afifa_Karam,"Riwāyat 'Ibnat Nā'ib al-Malik (1918) [Arabic translation of Une fille du régent by Alexandre Dumas]","Karam's novels and translations include:","include"
23743,https://en.wikipedia.org/wiki/%27Afifa_Karam,"Muḥammad 'Alī Bāsha al-Kabīr (1919) [Arabic translation of Muhammad Ali und Sein Haus by Luise Muhlbach]","Karam's novels and translations include:","include"
23744,https://en.wikipedia.org/wiki/%27Afu,"The One who blots out and leaves no trace of any sin or fault.","Descriptive meaning of the name","is"
23745,https://en.wikipedia.org/wiki/%27Afu,"The One who passes over and absolves any fault.","Descriptive meaning of the name","is"
23746,https://en.wikipedia.org/wiki/%27Afu,"The One who can remove and obliterate all traces of wrong actions.","Descriptive meaning of the name","is"
23747,https://en.wikipedia.org/wiki/%27Afu,"The One who can make any sin, error or fault disappear.","Descriptive meaning of the name","is"
23748,https://en.wikipedia.org/wiki/%27Afu,"to forgive, pardon","Afuw is said to come from the root 'a-f-a which has the following classical Arabic connotations:","come from"
23749,https://en.wikipedia.org/wiki/%27Afu,"to pass over, forgo, absolve","Afuw is said to come from the root 'a-f-a which has the following classical Arabic connotations:","come from"
23750,https://en.wikipedia.org/wiki/%27Afu,"to obliterate all traces, efface, remove","Afuw is said to come from the root 'a-f-a which has the following classical Arabic connotations:","come from"
23751,https://en.wikipedia.org/wiki/%27Afu,"to kill-off, allow to die","Afuw is said to come from the root 'a-f-a which has the following classical Arabic connotations:","come from"
23752,https://en.wikipedia.org/wiki/%27Afu,"to turn away from punishing, not see, annul","Afuw is said to come from the root 'a-f-a which has the following classical Arabic connotations:","come from"
23753,https://en.wikipedia.org/wiki/%27Afu,"to make unapparent, imperceptible","Afuw is said to come from the root 'a-f-a which has the following classical Arabic connotations:","come from"
23754,https://en.wikipedia.org/wiki/%27Afu,"to give spontaneously, to give without constraint","Afuw is said to come from the root 'a-f-a which has the following classical Arabic connotations:","come from"
23755,https://en.wikipedia.org/wiki/%27Afu,"to give more than what is due","Afuw is said to come from the root 'a-f-a which has the following classical Arabic connotations:","come from"